<tns:namistatistics xmlns:tns="http://www.example.org/namistatistics/"
	  xmlns:xsi="http://www.w3.org/2001/XMLSchema-instance"
      xsi:schemaLocation="http://www.example.org/namistatistics/ /home/fabian/eclipse/nami/src/nami/statistics/namistatistics.xsd">
	<database>
		<url>jdbc:mysql://localhost:3306/jnami?useServerPrepStmts=true</url>
		<username>jnami</username> <!-- optional (z. B. bei HSQLDB nicht nötig) -->
		<password>jnami</password>
	</database>
	<namiconnection useApi="false">
		<credentials type="NamiWalletCredentials">
			<!-- alternativ: NamiConsoleCredentials -->
			<username>12345</username> <!-- bei ConsoleCredentials optional -->
		</credentials>
	</namiconnection>
	<gruppe id="1" bezeichnung="Wölflinge">
		<namiSearch>
			<taetigkeit id="1" />
			<untergliederung id="1" />
		</namiSearch>
	</gruppe>
	<gruppe id="2" bezeichnung="Jungpfadfinder">
		<namiSearch>
			<taetigkeit id="1" />
			<untergliederung id="2" />
		</namiSearch>
	</gruppe>
	<gruppe id="3" bezeichnung="Pfadfinder">
		<namiSearch>
			<taetigkeit id="1" />
			<untergliederung id="3" />
		</namiSearch>
	</gruppe>
	<gruppe id="4" bezeichnung="Rover">
		<namiSearch>
			<taetigkeit id="1" />
			<untergliederung id="4" />
		</namiSearch>
	</gruppe>
	<gruppe id="5" bezeichnung="Leiter">
		<namiSearch>
			<taetigkeit id="6" /> <!-- LeiterIn -->
		</namiSearch>
		<namiSearch>
			<taetigkeit id="13" /> <!-- Vorsitzender -->
			<untergliederung id="5" /> <!-- Vorstand -->
		</namiSearch>
		<namiSearch>
			<taetigkeit id="11" /> <!-- Kurat -->
			<untergliederung id="5" /> <!-- Vorstand -->
		</namiSearch>
	</gruppe>
	<gruppe id="6" bezeichnung="Mitglieder">
		<namiSearch>
			<mitgliedstyp id="MITGLIED" />
		</namiSearch>
	</gruppe>
</tns:namistatistics>
